<?xml version="1.0" encoding="UTF-8"?>
<!-- edited with XMLSPY v5 rel. 4 U (http://www.xmlspy.com) by Registred (Registred) -->
<firmen xmlns:xsi="http://www.w3.org/2001/XMLSchema-instance" xsi:noNamespaceSchemaLocation="firmendb.xsd" xmlns:html="http://www.w3.org/TR/REC-html40">
	<firma>
		<name>Test</name>
		<strasse>Teststrasse 1</strasse>
		<standort>Testort</standort>
		<plz>12345</plz>
		<url>www.test.de</url>
		<email>test@test.de</email>
	</firma>
	<firma>
		<name>Test</name>
		<strasse>Teststrasse 1</strasse>
		<standort>Testort</standort>
		<plz>12345</plz>
		<url>www.test.de</url>
		<email>test@test.de</email>
	</firma>
	<firma>
		<name>Test</name>
		<strasse>Teststrasse 1</strasse>
		<standort>Testort</standort>
		<plz>12345</plz>
		<url>www.test.de</url>
		<email>test@test.de</email>
	</firma>
</firmen>
